a (an)	ad.	one
join	v.	to put together or come together
join	v.	to become part of or a member of
joint	ad.	shared by two or more
joke	n.	something done or said to cause others to laugh
judge	v.	to form an opinion about
judge	v.	to decide a question, especially a legal one
judge	n.	a public official who decides problems of law in a court
jump	v.	to push down on the feet and move up quickly into the air
jury	n.	a group of people chosen to decide what is true in a trial
just	ad.	only	Help me for just a minute.
just	ad.	very shortly before or after the present	He just left.
just	ad.	at the same time	He left just as I came in.
just	ad.	what is right or fair	The law is just, in my opinion.
justice	n.	the quality of being right, fair or lawful
keep	v.	to possess
keep	v.	to have for oneself
kick	v.	to hit with the foot
kidnap	v.	to seize and take away by force
kill	v.	to make dead
kill	v.	to cause to die
kind	n.	sort	What kind of dog is that?
kind	ad.	gentle
kind	ad.	caring
kind	ad.	helpful
kiss	v.	to touch with the mouth to show love or honor
knife	n.	a tool or weapon used to cut
know	v.	to understand something as correct
know	v.	to have the facts about
know	v.	to recognize someone because you have met and talked together before
knowledge	n.	that which is known
knowledge	n.	learning or understanding
labor	n.	work
labor	n.	workers as a group
laboratory	n.	a room or place where experiments in science are done
lack	v.	to be without
lack	n.	the condition of needing, wanting or not having
lake	n.	a large area of fresh water surrounded by land
land	v.	to come to the earth from the air	Airplanes land at airports.
land	n.	the part of the earth not covered by water
land	n.	the ground
language	n.	words and their use
language	n.	what people speak in a country, nation or group
large	ad.	big
large	ad.	being of more than usual size, amount or number
large	ad.	opposite small
laser	n.	an instrument that makes a thin, powerful light
last	v.	to continue	The talks will last three days.
last	ad.	after all others
last	ad.	the only one remaining	She is the last person in line.
late	ad.	after the correct time
late	ad.	near the end
late	ad.	opposite early
laugh	v.	to make sounds to express pleasure or happy feelings
launch	v.	to put into operation
launch	v.	to begin
launch	v.	to send into the air or space
law	n.	all or any rules made by a government
lead	v.	to show the way
lead	v.	to command
lead	v.	to control
lead	v.	to go first
leak	v.	to come out of or to escape through a small opening or hole (usually a gas or liquid)
learn	v.	to get knowledge about
learn	v.	to come to know a fact or facts
leave	v.	to go away from
leave	v.	to let something stay where it is
left	ad.	on the side that is toward the west when one is facing north
left	ad.	opposite right
legal	ad.	of or in agreement with the law
legislature	n.	a government lawmaking group
lend	v.	to permit someone to use a thing temporarily
lend	v.	to make a loan of money
less	ad.	smaller in amount
less	ad.	not as much
let	v.	to permit to do or to be
let	v.	to make possible
letter	n.	a message written on paper
letter	n.	a communication in writing sent to another person
level	n.	the amount or height that something reaches or rises to
level	n.	the position of something or someone
liberal	ad.	one who usually supports social progress or change
lie	v.	to have one's body on the ground or other surface
lie	v.	to say something that one knows is not true
life	n.	the time between being born and dying
life	n.	opposite death
life	n.	all living things
lift	v.	to take or bring up to a higher place or level
light	n.	a form of energy that affects the eyes so that one is able to see
light	n.	anything that produces light
light	ad.	bright
light	ad.	clear
light	ad.	not heavy
lightning	n.	light produced by electricity in the air, usually during a storm
like	v.	to be pleased with
like	v.	to have good feelings for someone or something
like	ad.	in the same way as
like	ad.	similar to
limit	v.	to restrict to a number or amount
limit	n.	the greatest amount or number permitted
line	n.	a long, thin mark on a surface
line	n.	a number of people or things organized
line	n.	one after another
line	n.	the edge of an area protected by military forces
link	v.	to connect
link	v.	to unite one thing or event with another
link	n.	a relation between two or more things, situations or events
liquid	n.	a substance that is not a solid or gas, and can move freely, like water
list	v.	to put in writing a number of names of people or things
list	n.	a written series of names or things
listen	v.	to try to hear
literature	n.	all the poems, stories and writings of a period of time or of a country
little	ad.	not tall or big
little	ad.	a small amount
live	v.	to have life
live	v.	to exist
live	ad.	having life
live	ad.	alive
load	v.	to put objects on or into a vehicle or container
load	n.	that which is carried
loan	n.	money borrowed that usually must be returned with interest payments
loan	n.	something borrowed
local	ad.	about or having to do with one place
lonely	adj.	feeling alone
long	ad.	not short
long	ad.	measuring from beginning to end
long	ad.	measuring much
long	ad.	for much time
look	v.	to turn the eyes toward so as to see
look	v.	to search or hunt for
look	v.	to seem to be
lose	v.	to have no longer
lose	v.	to not find
lose	v.	to fail to keep
lose	v.	to be defeated
loud	ad.	having a strong sound
loud	ad.	full of sound or noise
love	v.	to like very much
love	v.	to feel a strong, kind emotion (sometimes involving sex)
love	n.	a strong, kind emotion for someone or something
love	n.	opposite hate
low	ad.	not high or tall
low	ad.	below the normal height
low	ad.	close to the ground
loyal	ad.	showing strong friendship and support for someone or something
luck	n.	something that happens by chance
machine	n.	a device with moving parts used to do work
magazine	n.	a publication of news, stories, pictures or other information
magnet	n.	a piece of iron or other material that has a pulling force
magnet	n.	this pulling force is called magnetism
mail	n.	letters, papers and other things sent through an official system, such as a post office
main	ad.	the most important or largest
major	ad.	great in size, importance or amount
majority	n.	the greater number
majority	n.	more than half
make	v.	to produce
make	v.	to create
make	v.	to build
make	v.	to do something or to carry out an action
make	v.	to cause to be or to become
male	n.	a man or boy
male	n.	the sex that is the father of children
male	ad.	of or about men
man	n.	an adult male human
manufacture	v.	to make goods in large amounts
many	ad.	a large number or amount of
map	n.	a picture of the earth's surface or a part of it
march	v.	to walk in a group like soldiers
march	v.	to walk together in a large group to protest about something
mark	v.	to make a sign or cut on something
market	n.	a place or area where goods are sold, bought or traded
market	n.	an economic system in which the prices of things are decided by how many there are and how much money people are willing to pay for them
marry	v.	to join a man and woman together as husband and wife
marry	v.	to become husband and wife (usually in a religious or civil ceremony)
mass	n.	an amount of matter having no special form and usually of a large size
mate	v.	to bring together a male and a female to create another creature
material	n.	the substance, substances or matter of which something is made or from which something can be made, such as wood, cloth or stone
material	n.	anything that can be made into something else
mathematics	n.	the science dealing with amounts, sizes and shapes, as explained by numbers and signs
matter	n.	anything that can be seen or felt
matter	n.	what things are made of
may	v.	a word used with an action word to mean permit or possible	May I go? They may leave tomorrow.
mayor	n.	the chief official of a city or town government
meal	n.	food eaten to satisfy hunger, such as dinner
mean	v.	to want to
mean	v.	to give the idea of
mean	v.	to have the idea of
measure	v.	to learn the amount, size or distance of something
measure	n.	an action taken
measure	n.	a legislative proposal
meat	n.	the part of a dead animal used for food
media	n.	all public information organizations, including newspapers, television and radio
medicine	n.	a substance or drug used to treat disease or pain
medicine	n.	the science or study of treating and curing disease or improving health
meet	v.	to come together with someone or something at the same time and place
melt	v.	to make a solid into a liquid by heating it
member	n.	one of a group
memorial	n.	something done or made to honor the memory of a person or event
memory	n.	a picture in the mind of past events
memory	n.	the ability to remember
memory	n.	a thing remembered
mental	ad.	about or having to do with the mind
message	n.	written or spoken news or information
message	n.	a note from one person to another person or group
metal	n.	a hard substance such as iron, steel or gold
method	n.	the way something is done
microscope	n.	a device used to make very small things look larger so they can be studied
middle	n.	the center
middle	n.	a place or time of equal distance from both sides or ends
middle	ad.	in the center
militant	n.	someone active in trying to cause political change, often by the use of force or violence
military	n.	the armed forces of a nation or group
military	ad.	of or about the armed forces
militia	n.	an army of citizens instead of professional soldiers
militia	n.	an armed force or private army
milk	n.	the white liquid produced by female animals to feed their young
mind	n.	the thinking, feeling part of a person
mine	v.	to dig useful or valuable substances out of the earth
mine	n.	a place in the earth where such substances are found
mine	n.	a bomb placed under the ground or under water so it cannot be seen
mineral	n.	a substance found in nature that is not an animal or a plant, such as coal or salt
minister	n.	a member of a cabinet
minister	n.	a high government official	prime minister,foreign minister
minor	ad.	small in size
minor	ad.	of little importance
minority	n.	the smaller number
minority	n.	opposite majority
minute	n.	a measure of time
minute	n.	one of the sixty equal parts of an hour
minute	n.	sixty seconds
miss	v.	to fail to hit, see, reach or meet
missile	n.	any weapon that can be thrown or fired through the air and explodes when it reaches its target
missing	ad.	lost
missing	ad.	not found
mistake	n.	a wrong action or decision
mistake	n.	an action done without the knowledge that it was wrong
mix	v.	to put different things together to make one thing
mob	n.	a large group of wild or angry people
model	n.	an example
model	n.	something, usually small, made to show how something will look or work
moderate	ad.	not extreme
modern	ad.	of the present or very recent time
modern	ad.	the most improved
molecule	n.	the smallest amount of a chemical substance that can exist
money	n.	pieces of metal or paper used to pay for things
month	n.	one of the twelve periods of time into which a year is divided
moon	n.	the bright object often seen in the night sky that orbits the earth about every twenty-nine days
moral	ad.	concerning what is right or wrong in someone's actions
more	ad.	greater in size or amount
morning	n.	the early part of the day, from sunrise until noon
most	ad.	greatest in size or amount
mother	n.	the female parent
mother	n.	a woman who has a child or children
motion	n.	a movement
motion	n.	a continuing change of position or place
mountain	n.	a part of the earth's surface that rises high above the area around it
mourn	v.	to express or feel sadness
move	v.	to change position
move	v.	to put or keep in motion
move	v.	to go
movement	n.	the act of moving or a way of moving
movement	n.	a series of acts or efforts to reach a goal
movie	n.	a motion picture
movie	n.	a film
much	ad.	great in amount
murder	v.	to kill another person illegally
murder	n.	the crime of killing another person
music	n.	the making of sounds by singing or using a musical instrument
must	v.	a word used with an action word to mean necessary	You must go to school.
mystery	n.	something that is not or cannot be explained or understood
mystery	n.	a secret
name	v.	to appoint
name	v.	to nominate
name	v.	to give a name to
name	n.	a word by which a person, animal or thing is known or called
narrow	ad.	limited in size or amount
narrow	ad.	not wide
narrow	ad.	having a short distance from one side to the other
nation	n.	a country, together with its social and political systems
native	n.	someone who was born in a place, not one who moved there
natural	ad.	of or about nature
natural	ad.	normal
natural	ad.	common to its kind
nature	n.	all the plants, animals and other things on earth not created by humans
nature	n.	events or processes not caused by humans
navy	n.	the part of a country's military force trained to fight at sea
near	ad.	not far
near	ad.	close to
necessary	ad.	needed to get a result or effect
necessary	ad.	required
need	v.	to require
need	v.	to want
need	v.	to be necessary to have or to do
negotiate	v.	to talk about a problem or situation to find a common solution
neighbor	n.	a person or country that is next to or near another
neither	ad.	not one or the other of two
nerve	n.	a thin piece of tissue that sends information through the body to and from the brain
neutral	ad.	not supporting one side or the other in a dispute
never	ad.	at no time
never	ad.	not ever
new	ad.	not existing before
new	ad.	not known before
new	ad.	recently made, built, bought or grown
new	ad.	another
new	ad.	different
news	n.	information about any recent events, especially as reported by the media
next	ad.	coming immediately after
next	ad.	nearest
nice	ad.	pleasing
nice	ad.	good
nice	ad.	kind
night	n.	the time between when the sun goes down and when it rises, when there is little or no light
no	ad.	used to reject or to refuse
no	ad.	not any
no	ad.	not at all
noise	n.	sound, especially when loud
nominate	v.	to name someone as a candidate for an election
nominate	v.	to propose a person for an office or position
noon	n.	the middle of the day
noon	n.	twelve o'clock in the daytime
normal	n.	the usual condition, amount or form
normal	ad.	usual
normal	ad.	what is expected
north	n.	the direction to the left of a person facing the rising sun
not	ad.	a word showing that something is denied or untrue	She is not going.
note	v.	to talk about something already known
note	n.	a word or words written to help a person remember
note	n.	a short letter
nothing	n.	not anything
nothing	n.	no thing
now	ad.	at this time
now	ad.	immediately
nowhere	ad.	not in, to or at any place
nuclear	ad.	of or about the energy produced by splitting atoms or bringing them together
nuclear	ad.	of or about weapons that explode by using energy from atoms
nucleic acid	n.	a molecule that holds the genetic information necessary for life
nucleic acid	n.	there are two kinds of nucleic acid
nucleic acid	n.	DNA (deoxyribonucleic acid) and RNA (ribonucleic acid)
nucleus	n.	the center part of an atom or cell
nutrient	n.	a food or substance that makes plants, humans or animals grow
number	n.	a word or sign used to show the order or amount of things
obey	v.	to act as one is ordered to act
object	v.	to show that one does not like or approve
object	v.	to protest
object	n.	something not alive that can be seen or touched
observe	v.	to watch
observe	v.	to look at carefully
observe	v.	to celebrate or honor something	They will observe the anniversary of the day she was born.
occupy	v.	to take and hold or to control by force
ocean	n.	the area of salt water that covers almost seventy-five percent of the earth's surface
ocean	n.	any of the five main divisions of this water
of	prep.	made from
of	prep.	belonging to
of	prep.	about
of	prep.	connected to
of	prep.	included among
off	ad.	away
off	ad.	at a distance
off	ad.	condition when something is no longer operating or continuing
off	ad.	not on
off	ad.	not connected
offensive	n.	a military campaign of attack
offensive	ad.	having to do with attacking
offer	v.	to present or propose
offer	n.	the act of presenting or proposing
offer	n.	that which is presented or proposed
office	n.	a room or building where business or work is done
office	n.	a public position to which one is elected or appointed
officer	n.	a person in the military who commands others
officer	n.	any person who is a member of a police force
official	n.	a person with power in an organization
official	n.	a representative of an organization or government
official	ad.	of or about an office
official	ad.	approved by the government or someone in power
often	ad.	many times
oil	n.	a thick liquid that does not mix with water and that burns easily
oil	n.	a black liquid taken from the ground and used as fuel
old	ad.	not young or new
old	ad.	having lived or existed for many years
on	prep.	above and held up by
on	prep.	touching the upper surface of	The book is on the table.
on	prep.	supported by	He is on his feet.
on	prep.	about	The report on the meeting is ready.
on	prep.	at the time of	He left on Wednesday.
once	ad.	one time only
only	ad.	being the single one or ones
only	ad.	no more than	We have only two dollars.
open	v.	to start	They opened talks.
open	ad.	not closed
open	ad.	not secret
operate	v.	to do work or a job
operate	v.	to cut into the body for medical reasons
opinion	n.	a belief based on one's own ideas and thinking
oppose	v.	to be against
oppose	v.	to fight against
opposite	ad.	different as possible
opposite	ad.	completely different from
opposite	ad.	exactly the other way	North is the opposite direction from south.
oppress	v.	to make others suffer
oppress	v.	to control by the use of unjust and cruel force or power
or	conj.	giving another of two choices
or	conj.	giving the last of several choices
orbit	v.	to travel in space around a planet or other object
orbit	n.	the path or way an object travels in space around another object or planet
order	v.	to give a command
order	v.	to tell someone what to do
order	n.	a command
order	n.	the correct or normal way things are organized
order	n.	a peaceful situation in which people obey laws
organ	n.	a part of the body that has a special purpose, such as the heart or brain
organism	n.	a living thing, often so small it can be seen only through a microscope
organize	v.	to put in order
organize	v.	to put together into a system
other	ad.	different
other	ad.	of another kind
other	ad.	the remaining one or ones of two or more	That man is short
other	ad.	the other is tall.")
our	ad.	of or belonging to us
oust	v.	to force to leave
oust	v.	to remove by force
out	ad.	away from the inside
out	ad.	opposite of in
over	conj.	above
over	conj.	covering
over	conj.	across, in or on every part of	all over the world
overthrow	v.	to remove from power
overthrow	v.	to defeat or end by force
owe	v.	to pay or have to repay (usually money) in return for something received
own	v.	to have or possess for oneself
pain	n.	a hurt or suffering somewhere in the body
paint	v.	to cover with a liquid color
paint	v.	to make a picture with liquid colors
paint	n.	a colored liquid used to cover or protect a surface
paper	n.	a thin, flat material made from plants or cloth often used for writing
parachute	n.	a device that permits a person or thing to fall slowly from an airplane or helicopter to the ground
parade	n.	a group of people and vehicles moving together to celebrate a special event or anniversary
pardon	v.	to forgive for a crime and release from punishment
parent	n.	a father or mother
parliament	n.	a government lawmaking group
part	n.	something less than the whole
part	n.	not all of something
particle	n.	a very small piece of matter
partner	n.	a person who takes part in some activity in common with another or others.	The two men were business partners.
party	n.	a group of people working together for a political purpose
party	n.	a group of people or friends gathered together for enjoyment
pass	v.	to go by or move around something
pass	v.	to move along
pass	v.	to cause or permit to go
passenger	n.	a person travelling by airplane, train, boat or car who is not the pilot or driver
passport	n.	an official government document that shows a person's identity and citizenship and permits a citizen to travel to another country
past	n.	the time gone by
past	n.	the time before
past	ad.	recent
past	ad.	immediately before
past	ad.	former
path	n.	a narrow way for walking
path	n.	a way along which something moves
patient	n.	a person being treated by a doctor for a health problem
pay	v.	to give money for work done or for something bought
peace	n.	the condition of freedom from war, fighting or noise
peace	n.	rest
peace	n.	quiet
people	n.	any group of persons
people	n.	all the persons of a group, race, religion or nation	the American people
percent	n.	a part of every hundred	Ten is ten percent of one hundred.
perfect	ad.	complete or correct in every way
perfect	ad.	completely right or good
perfect	ad.	without mistakes
perform	v.	to speak, dance or sing in front of others
period	n.	an amount of time within events, restrictions or conditions
permanent	ad.	never changing
permanent	ad.	lasting for a very long time or for all time
permit	v.	to let
permit	v.	to make possible
person	n.	a man, woman or child
persuade	v.	to cause someone to do something by explaining or urging	The police persuaded the criminal to surrender his weapon.
physical	ad.	of the body
physics	n.	the study of motion, matter and energy
picture	n.	something that shows what another thing looks like
picture	n.	an idea or representation of something as seen by the eye
picture	n.	a painting
picture	n.	what is made with a camera
piece	n.	a part of something larger
pig	n.	a farm animal used for its meat
pilot	n.	one who guides or flies an airplane or helicopter
pipe	n.	a long, round piece of material used to move liquid or gas
place	v.	to put something somewhere
place	n.	an area or a part of an area
place	n.	space where a person or thing is
place	n.	any room, building, town or country
plan	v.	to organize or develop an idea or method of acting or doing something	They plan to have a party.
plan	n.	an organized or developed idea or method	The plan will not work.
planet	n.	a large object in space that orbits the sun	Earth is a planet.
plant	v.	to put into the ground to grow
plant	n.	a living growth from the ground which gets its food from air, water and earth
plastic	n.	a material made from chemicals that can be formed and made into things
play	v.	to have fun
play	v.	to not work
play	v.	to take part in a sport
play	v.	to make music on an instrument
play	n.	a story acted in a theater
please	v.	to make one happy
please	v.	to give enjoyment
plenty	n.	all that is needed
plenty	n.	a large enough amount
plot	v.	to make secret plans
plot	n.	a secret plan to do something wrong or illegal
poem	n.	words and their sounds organized in a special way to express emotions
point	v.	to aim one's finger toward
point	v.	to aim
point	n.	the sharp end of something
poison	n.	a substance that can destroy life or damage health
police	n.	a government agency responsible for guarding the public, keeping order, and making sure people obey the law
police	n.	members of that agency
policy	n.	an established set of plans or goals used to develop and make decisions in politics, economics or business
politics	n.	the activities of government and of those who are in public office
pollute	v.	to release dangerous or unpleasant substances into the air, soil or water
poor	n.	people with little or no money
poor	ad.	lacking money or goods
poor	ad.	of bad quality
popular	ad.	liked by many people
popular	ad.	generally approved by the public
population	n.	all the people in a place, city or country
port	n.	a city where ships load or unload goods
port	n.	a place on a coast where ships can be safe from a storm
position	n.	a place
position	n.	the way of holding the body
position	n.	the way a thing is set or placed
position	n.	a job (or level of a job) in an organization
possess	v.	to have
possess	v.	to own
possess	v.	to control or be controlled by
possible	ad.	able to be done
possible	ad.	can happen or is expected to happen
postpone	v.	to delay action until a later time
pour	v.	to flow
pour	v.	to cause to flow
poverty	n.	the condition of being poor
power	n.	the ability to control or direct others
power	n.	control
power	n.	strength
power	n.	ruling force
power	n.	force or energy used to do work	Water power turns the wheel.
praise	v.	to say good things about
praise	v.	to approve
pray	v.	to make a request to a god or spirit
pray	v.	to praise a god or spirit
predict	v.	to say what one believes will happen in the future.	The weather scientist predicted a cold winter.
pregnant	ad.	carrying a child within the body before it is born
pregnant	ad.	expecting to give birth to a baby
present	v.	to offer for consideration	We will present our idea to the committee.
present	n.	a gift	I gave them a present for their anniversary.
present	ad.	now	The present time is a good time.
present	ad.	to be at a place	I was present at school yesterday.
president	n.	the chief official of a country that is a republic
president	n.	the leader of an organization
press	v.	to urge strongly
press	n.	newspapers, magazines and other publications
pressure	n.	the force produced when something is pushed down or against something else
prevent	v.	to keep or stop from going or happening
price	n.	the amount of money for which anything is bought, sold or offered for sale
prison	n.	a place where a person is kept as punishment for a crime
private	ad.	of or about a person or group that is secret
private	ad.	opposite public
prize	n.	something offered or won in a competition
prize	n.	something of value that one must work hard for
probably	ad.	a good chance of taking place
probably	ad.	a little more than possible
problem	n.	a difficult question or situation with an unknown or unclear answer
process	n.	an operation or series of changes leading to a desired result
produce	v.	to make
produce	v.	to create
produce	v.	to cause something to be
produce	v.	to manufacture
