a (an)	ad.	one
document	n.	an official piece of paper with facts written on it, used as proof or support of something
dog	n.	a small animal that often lives with humans
dollar	n.	United States money, one hundred cents
donate	v.	to present something as a gift to an organization, country or cause.	She donated money to the Red Cross to help survivors of the earthquake.
door	n.	an opening for entering or leaving a building or room
double	v.	to increase two times as much in size, strength or number.
down	ad.	from higher to lower
down	ad.	in a low place
dream	v.	to have a picture or story in the mind during sleep
dream	n.	a picture or story in the mind during sleep
dream	n.	a happy idea about the future
drink	v.	to take liquid into the body through the mouth
drive	v.	to control a moving vehicle
drop	v.	to fall or let fall
drop	v.	to go lower
drown	v.	to die under water
drug	n.	anything used as a medicine or in making medicine
drug	n.	a chemical substance used to ease pain or to affect the mind
dry	ad.	not wet
dry	ad.	without rain
during	ad.	through the whole time
during	ad.	while (something is happening)
dust	n.	pieces of matter so small that they can float in the air
duty	n.	one's job or responsibility
duty	n.	what one must do because it is right and just
each	ad.	every one by itself
early	ad.	at or near the beginning, especially the beginning of the day
early	ad.	opposite late
earn	v.	to be paid in return for work done
earth	n.	the planet we all live on
earth	n.	the ground or soil
earthquake	n.	a sudden, violent shaking of the earth's surface
ease	v.	to reduce
ease	v.	to make less difficult
east	n.	the direction from which the sun rises
easy	ad.	not difficult
easy	ad.	not hard to do
eat	v.	to take food into the body through the mouth
ecology	n.	the scientific study of the environment and links among living and material things
economy	n.	the system by which money, industry and trade are organized
edge	n.	the line where something ends or begins
education	n.	the act of teaching
effect	n.	the result or change caused by something	The storm had a serious effect on the economy.
effort	n.	an attempt
effort	n.	the work necessary to do something
egg	n.	the rounded object containing unborn young produced by female birds, fish or reptiles
egg	n.	a single cell in a female person or animal that can develop into a baby
either	ad.	one of two, but not the other
elect	v.	to choose by voting
electron	n.	a small part of an atom that has an electrical force
electricity	n.	a form of energy that flows through wires to provide heat and light, and power to machines
element	n.	one of more than 100 substances known to science that cannot be separated into other substances
embassy	n.	the offices of an ambassador and his or her assistants
embryo	n.	a human or animal in the earliest stages of its development
emergency	n.	an unexpected and dangerous situation demanding quick action
emotion	n.	a strong feeling such as love, hate, fear or sadness
employ	v.	to give work in return for wages
empty	ad.	having nothing inside
empty	v.	to remove everything
end	v.	to stop
end	v.	to finish
end	n.	the part which comes last
enemy	n.	a person opposing or hating another
enemy	n.	a person or people of the other side in a war
energy	n.	power used to do work, usually with machines
energy	n.	the ability and willingness to be active
enforce	v.	to make something be done
engine	n.	a machine that uses energy to cause movement or to do work
engineer	n.	a person who designs engines, machines, roads, bridges or railroads
enjoy	v.	to be pleased or satisfied by something
enough	ad.	as much as necessary
enter	v.	to come or go into
environment	n.	all surrounding things, conditions and influences that affect life
environment	n.	the natural world of land, sea, air, plants and animals
enzyme	n.	a special kind of protein
enzyme	n.	it produces changes in other substances without being changed itself
equal	ad.	the same in amount, size, weight or value
equal	ad.	having the same rights
equipment	n.	things, tools or machines needed for a purpose or activity
escape	v.	to get free
escape	v.	to get away from
escape	v.	to get out of
especially	ad.	more than others	We liked the food, especially the fish.
establish	v.	to bring into existence
establish	v.	to create
estimate	v.	to form an opinion about a value, size or amount using less than complete information
ethnic	ad.	of or concerning people belonging to a large group because of their race, religion, language, tribe or where their ancestors lived
evaporate	v.	to change from a liquid into a gas
even	ad.	in a way not thought possible	They survived, even though the building was destroyed.
event	n.	that which happens, especially something of importance
ever	ad.	at any time
every	ad.	each one
every	ad.	all
evidence	n.	material or facts that prove something
evidence	n.	a reason for believing
evil	ad.	not good
evil	ad.	extremely bad
exact	ad.	having no mistakes
exact	ad.	correct in every detail
examine	v.	to study closely
example	n.	a part that shows what the rest of a thing or group is like
excellent	ad.	extremely good
except	prep.	but for
exchange	v.	to trade
exchange	v.	to give or receive one thing for another
excuse	v.	to take away blame
excuse	v.	to pardon
excuse	v.	to forgive
excuse	n.	a reason (sometimes false) for an action
execute	v.	to kill
exercise	n.	an activity or effort for the purpose of improving the body or to stay in good health
exile	v.	to force a person to leave his or her country
exile	v.	to expel
exile	n.	a person who is forced to leave his or her country
exist	v.	to be
exist	v.	to live
expand	v.	to make larger
expand	v.	to grow larger
expect	v.	to think or believe that something will happen
expect	v.	to wait for an event
expel	v.	to force out
expel	v.	to remove from
expel	v.	to send away
experience	v.	to live through an event, situation or condition	She experienced great pain.
experience	n.	something that one has done or lived through	The experience caused her great pain.
experiment	v.	to test
experiment	n.	a test or trial carried out to prove if an idea is true or false, or to discover something
expert	n.	a person with special knowledge or training
explain	v.	to give reasons for
explain	v.	to make clear
explain	v.	to tell about
explain	v.	to tell the meaning
explode	v.	to break apart violently with a loud noise, like a bomb
explore	v.	to travel in a place that is not well known to learn more about it
explore	v.	to make a careful search
explore	v.	to examine closely
export	v.	to send to another country
export	n.	something sent to another country, usually for sale
express	v.	to say clearly
extend	v.	to stretch out in area or length
extend	v.	to continue for a longer time
extra	ad.	more than normal, expected or necessary
extraordinary	ad.	far greater or better than the usual or normal
extreme	ad.	more than the usual or accepted
extremist	n.	a person with strong religious or political beliefs who acts in an extreme or violent way
face	n.	the front of the head: eyes, nose, mouth
face	v.	to look toward
face	v.	to turn toward
face	v.	to have before you, such as a problem or danger
fact	n.	something known or proved to be true
factory	n.	a building or group of buildings where goods are made
fail	v.	to not succeed
fail	v.	to not reach a goal
fair	ad.	just
fair	ad.	honest
fair	ad.	what is right
fall	v.	to go down quickly
fall	v.	to come down
fall	v.	to drop to the ground or a lower position
false	ad.	not true
false	ad.	not correct
family	n.	the group that includes children and their parents
famous	ad.	known very well to many people
fan	n.	a person who actively supports a sport, activity or performer	The baseball fan attended every game his team played.
far	ad.	at, to or from a great distance
farm	n.	land used to grow crops and animals for food
fast	ad.	moving or working at great speed
fast	ad.	quick
fat	n.	tissue in the bodies of humans and animals used to store energy and to keep warm
fat	ad.	thick
fat	ad.	heavy
father	n.	the male parent
father	n.	a man who has a child or children
favorite	ad.	liked more than others	Ice cream was her favorite food.
fear	v.	to be afraid
fear	v.	to worry that something bad is near or may happen	He feared falling down.
fear	n.	a strong emotion when there is danger or trouble	He had a fear that he would fall down.
federal	ad.	of or having to do with a national or central government
feed	v.	to give food to
feel	v.	to have or experience an emotion
feel	v.	to know by touching
female	n.	a woman or girl
female	n.	the sex that gives birth
female	ad.	of or about women
fence	n.	something around an area of land to keep animals or people in or out
fertile	ad.	rich in production of plants or animals
fertile	ad.	producing much
fetus	n.	unborn young
few	ad.	not many
few	ad.	a small number of
field	n.	an area of open land, usually used to grow crops or to raise animals
fierce	ad.	extremely strong
fierce	ad.	violent
fierce	ad.	angry
fight	v.	to use violence or force
fight	v.	to attempt to defeat or destroy an enemy
fight	n.	the use of force
fight	n.	a battle
fill	v.	to put or pour something into a container until there is space for no more
film	v.	to record something so it can be seen again
film	v.	to make a motion picture or movie
film	n.	a thin piece of material for making pictures with a camera
film	n.	a movie
final	ad.	at the end
final	ad.	last
financial	ad.	of or about the system that includes the use of money, credit, investments and banks
find	v.	to discover or learn something by searching or by accident
find	v.	to decide a court case	The jury finds the man guilty of murder.
fine	n.	a payment ordered by a court to punish someone for a crime
fine	ad.	very good
fine	ad.	very small or thin
finish	v.	to complete
finish	v.	to end
fire	v.	to shoot a gun
fire	n.	the heat and light produced by something burning
fireworks	n.	rockets producing bright fire in the sky, used in holiday celebrations
firm	ad.	not easily moved or changed	She is firm in her opinion.
first	ad.	coming before all others
fish	n.	a creature that lives and can breathe in water
fission	n.	a splitting
fission	n.	in atomic fission, the nucleus of an atom is split to produce nuclear energy
fit	v.	to be of the correct size or shape	These shoes fit my feet.
fix	v.	to make good or right again
flag	n.	a piece of colored cloth used to represent a nation, government or organization
flat	ad.	smooth
flat	ad.	having no high places
flee	v.	to run away from
float	v.	to be on water without sinking
float	v.	to move or be moved gently on water or through air
flood	v.	to cover with water
flood	n.	the movement of water out of a river, lake or ocean onto land
floor	n.	the bottom part of a room for walking on	The book fell to the floor.
floor	n.	the level of a building	The fire was on the first floor.
flow	v.	to move like a liquid
flower	n.	the colored part of plants that carry seeds
fluid	n.	any substance that can flow, such as a liquid
fly	v.	to move through the air with wings, like a bird or airplane
fly	v.	to travel in an airplane or flying vehicle
fog	n.	a mass of wet air that is difficult to see through
fog	n.	a cloud close to the ground
follow	v.	to come or go after
follow	v.	to accept the rule or power of
follow	v.	to obey
food	n.	that which is taken in by all living things for energy, strength and growth
fool	v.	to make someone believe something that is not true
fool	v.	to trick
fool	n.	a person who is tricked easily
foot	n.	the bottom part of the leg
foot	n.	the part of the body that touches the ground when a person or animal walks
for	prep.	because of	He is famous for his work.
for	prep.	in exchange	Give me one dollar for the book.
for	prep.	through space or time	They travelled for one hour.
for	prep.	representative of	I speak for all people.
for	prep.	to be employed by	She works for a computer company.
force	v.	to make someone do something or make something happen by using power
force	n.	power, strength
force	n.	strength used against a person or object
force	n.	military power of a nation
force	n.	a military group
foreign	ad.	of, about or from another nation
foreign	ad.	not from one's own place or country
forest	n.	a place of many trees
forget	v.	to not remember
forgive	v.	to pardon
forgive	v.	to excuse
forgive	v.	to remove guilt
form	v.	to make
form	v.	to start
form	v.	to shape	They formed a swim team.
form	n.	a kind	Swimming is a form of exercise.
former	ad.	earlier in time
former	ad.	not now
forward	ad.	the direction in front of
forward	ad.	toward the front
free	v.	to release
free	ad.	not controlled by another or by outside forces
free	ad.	not in prison
free	ad.	independent
free	ad.	not limited by rules
free	ad.	without cost
freedom	n.	the condition of being free
freeze	v.	to cause or to become very cold
freeze	v.	to make or to become hard by cold
fresh	ad.	newly made or gathered
fresh	ad.	recent
friend	n.	a person one likes and trusts
frighten	v.	to cause great fear
from	prep.	having a person, place or thing as a beginning or cause	It is a message from the president.
from	prep.	at a place distant, not near	The school is five kilometers from my home.
from	prep.	because of	He is suffering from cancer.
front	n.	the forward part
front	n.	the opposite of back
front	n.	the beginning
front	n.	the first part
fruit	n.	food from trees and plants
fuel	n.	any substance burned to create heat or power
full	ad.	containing as much as a person or thing can hold
full	ad.	complete
fun	n.	anything that is pleasing and causes happiness
funeral	n.	a ceremony held in connection with the burial or burning of the dead
fusion	n.	a joining together
fusion	n.	in atomic fusion, atomic particles are joined together to produce nuclear energy
future	n.	time after now	We can talk about it in the future.
future	ad.	in the time to come	All future meetings will be held in this room.
gain	v.	to get possession of
gain	v.	to get more
gain	v.	to increase
game	n.	an activity with rules in which people or teams play or compete, usually sports
gas	n.	any substance that is not solid or liquid
gas	n.	any substance that burns to provide heat, light or power
gather	v.	to bring or come together into a group or place
gather	v.	to collect
general	n.	a high military leader
general	ad.	without details
general	ad.	affecting or including all or almost all
generation	n.	a group of individuals born and living about the same time.	The mother and daughter represented two generations.
genes	n.	parts of cells that control the growth and development of living things
genes	n.	genes from the mother and father are passed to the child
genes	n.	genes contain nucleic acid
genetic engineering	n.	the science of changing the genes of a living organism
genocide	n.	a plan of action to kill or destroy a national, religious, racial or ethnic group
gentle	adj.	soft
gentle	adj.	kind
gentle	adj.	not rough or violent
get	v.	to receive
get	v.	to gain
get	v.	to go and bring back
get	v.	to become
get	v.	to become the owner of
gift	n.	something given without cost
girl	n.	a young female person
give	v.	to present to another to keep without receiving payment
glass	n.	a hard, clear material that is easily broken, used most often for windows or for containers to hold liquids
go	v.	to move from one place to another
go	v.	to leave
goal	n.	that toward which an effort is directed
goal	n.	that which is aimed at
goal	n.	the end of a trip or race
god	n.	the spirit that is honored as creator of all things	They believe in God.
god	n.	a spirit or being believed in many religions to have special powers
gold	n.	a highly valued yellow metal
good	ad.	pleasing
good	ad.	helpful
good	ad.	kind
good	ad.	correct
good	ad.	not bad
goods	n.	things owned or made to be sold
govern	v.	to control
govern	v.	to rule by military or political power
government	n.	a system of governing
government	n.	the organization of people that rules a country, city or area
grain	n.	the seed of grass plants used for food, such as wheat, rice and corn
grain	n.	those plants that produce the seeds
grass	n.	a plant with long, narrow, green leaves
gravity	n.	the force that pulls things toward the center of the Earth
gray	ad.	having the color like that made by mixing black and white
great	ad.	very large or more than usual in size or number
great	ad.	very good
great	ad.	important
green	ad.	having the color like that made by mixing yellow and blue
green	ad.	having the color like that of growing leaves and grass
grind	v.	to reduce to small pieces by crushing
ground	n.	land
ground	n.	the earth's surface
ground	n.	soil
group	n.	a number of people or things together
group	n.	a gathering of people working for a common purpose
grow	v.	to develop or become bigger
grow	v.	to increase in size or amount
guarantee	v.	to promise a result
guarantee	v.	to promise that something will happen
guard	v.	to watch and protect a person, place or thing	He guards the president.
guard	n.	a person or thing that watches or protects	He is a prison guard.
guerrilla	n.	a person who fights as part of an unofficial army, usually against an official army or police
guide	v.	to lead to
guide	v.	to show the way
guide	n.	one who shows the way
guilty	ad.	having done something wrong or in violation of a law
guilty	ad.	responsible for a bad action
gun	n.	a weapon that shoots bullets
hair	n.	the fine material that grows from the skin, especially from the head
half	n.	one of two equal parts of something
halt	v.	to come or cause to come to a stop
halt	v.	to stop
hang	v.	to place something so the highest part is supported and the lower part is not
hang	v.	to kill by hanging
happen	v.	to become a fact or event
happen	v.	to take place
happy	ad.	pleased
happy	ad.	satisfied
happy	ad.	feeling good
happy	ad.	not sad
hard	ad.	not easily cut or broken
hard	ad.	solid
hard	ad.	difficult to do or understand
hard	ad.	needing much effort or force
harm	v.	to injure
harm	v.	to damage
harm	n.	damage
harm	n.	hurt
harvest	v.	to gather crops
harvest	n.	the crop after it is gathered
hat	n.	a head cover
hate	v.	to have strong emotions against
hate	v.	to consider as an enemy
hate	v.	opposite love
have	v.	to possess
have	v.	to own
have	v.	to hold
he	pro.	the boy or man who is being spoken about
head	v.	to lead
head	v.	to command
head	n.	leader
head	n.	chief
head	n.	the top part of something
head	n.	the highest position
headquarters	n.	the center from which orders are given
headquarters	n.	the main offices of a business or organization
heal	v.	to return to good health
heal	v.	to cure
heal	v.	to become well
health	n.	the general condition of the body and mind
health	n.	the condition of being free from sickness or disease
hear	v.	to receive sound through the ears
hear	v.	to receive news about
heat	v.	to make hot or warm
heat	n.	great warmth
heat	n.	that which is produced by burning fuel
heat	n.	energy from the sun
heavy	ad.	having much weight
heavy	ad.	not easy to lift
heavy	ad.	of great amount or force
helicopter	n.	a machine without wings that can fly up or down or remain in one place above the ground
help	v.	to give support
help	v.	to assist
help	v.	to make easier
help	n.	support
help	n.	aid
here	ad.	in, to or at this place
hero	n.	a person honored for being brave or wise
hide	v.	to prevent from being seen or found
hide	v.	to make secret
high	ad.	tall
high	ad.	far up
high	ad.	far above the ground
high	ad.	important
high	ad.	above others
hijack	v.	to seize or take control of a vehicle by force
hill	n.	a small mountain
history	n.	the written record or description of past events
history	n.	the study of the past
hit	v.	to strike
hit	v.	to touch with force
hold	v.	to carry or support, usually in the hands or arms
hold	v.	to keep in one position
hold	v.	to keep as a prisoner
hold	v.	to contain
hold	v.	to possess
hold	v.	to occupy
hold	v.	to organize and be involved in	The two sides hold talks this week.
hole	n.	an opening
hole	n.	a torn or broken place in something
holiday	n.	a day when one does not work
holiday	n.	a day on which no work is done to honor or remember a person or event
holy	ad.	greatly honored in religion
home	n.	the building where a person lives, especially with family
home	n.	the place where one was born or comes from
home	n.	the area or country where one lives
honest	ad.	truthful
honest	ad.	able to be trusted
honor	v.	to obey
honor	v.	to show strong, good feelings for	to honor one's parents
honor	n.	an award
honor	n.	an act of giving special recognition	He received many honors for his efforts to help others.
hope	v.	to expect
hope	v.	to believe there is a good chance that something will happen as wanted
hope	v.	to want something to happen
horrible	ad.	causing great fear
horrible	ad.	terrible
horse	n.	a large animal often used for racing, riding or farm work
hospital	n.	a place where sick or injured people are given medical care
hostage	n.	a person captured and held as a guarantee that a demand or promise will be honored
hostile	ad.	ready to fight
hostile	ad.	ready for war
hot	ad.	having or feeling great heat or a high temperature
hotel	n.	a building with rooms, and often food, for travellers
hour	n.	a measure of time
hour	n.	sixty minutes
house	n.	a building in which people live
house	n.	a country's parliament or lawmaking group	House of Representatives
how	ad.	in what way
how	ad.	to what amount
however	conj.	yet
however	conj.	but
huge	ad.	very big
huge	ad.	of great size
human	ad.	of or about people
humor	n.	the ability to understand, enjoy or express what makes people laugh
hunger	n.	the need for food
hunt	v.	to search for animals to capture or kill them
hunt	v.	to seek
hunt	v.	to try to find
hurry	v.	to do or go fast
hurt	v.	to cause pain, injury or damage
husband	n.	a man who is married
I	pro.	the person speaking
ice	n.	frozen water
idea	n.	a thought or picture in the mind
idea	n.	a belief
identify	v.	to recognize someone or something and to say who or what they are
if	conj.	on condition
if	conj.	provided that	I will go if you go.
ignore	v.	to pay no attention to or refuse to consider	The president ignored the protesters outside his office.
illegal	ad.	not legal
illegal	ad.	in violation of a law
image	n.	a reproduction of the appearance of a person or thing
imagine	v.	to make a picture in the mind
imagine	v.	to form an idea
immediate	ad.	without delay
immediate	ad.	very near in time or place
immigrant	n.	a person who arrives in a country to live there
import	v.	to bring from another country
import	n.	something brought from another country, usually for sale
important	ad.	having great meaning, value or power
improve	v.	to make better
improve	v.	to become better
in	prep.	inside
in	prep.	held by
in	prep.	contained by
in	prep.	surrounded by
in	prep.	during
incident	n.	an event or something that happens
incite	v.	to urge or cause an action or emotion, usually something bad or violent
include	v.	to have
include	v.	to make a part of
increase	v.	to make more in size or amount
independent	ad.	not influenced by or controlled by another or others
independent	ad.	free
independent	ad.	separate
individual	n.	one person
industry	n.	any business that produces goods or provides services
industry	n.	the work and related activity in factories and offices
industry	n.	all organizations involved in manufacturing
infect	v.	to make sick with something that causes disease
inflation	n.	a continuing rise in prices while the value of money goes down
influence	v.	to have an effect on someone or something
influence	v.	to cause change
inform	v.	to tell
inform	v.	to give knowledge to
information	n.	knowledge
information	n.	facts
inject	v.	to force a fluid into, such as putting medicine or drugs into the body through the skin
injure	v.	to cause harm or damage to a person or animal
innocent	ad.	not guilty of a crime
innocent	ad.	not responsible for a bad action
insane	ad.	mentally sick
insect	n.	a very small creature, usually with many legs and sometimes with wings
inspect	v.	to look at something carefully
inspect	v.	to examine, especially by an expert
instead	ad.	in the place of
instead	ad.	taking the place of
instrument	n.	a tool or device designed to do something or to make something
insult	v.	to say something or to do something that makes another person angry or dishonored
intelligence	n.	the ability to think or learn
intelligence	n.	information gathered by spying
intelligent	ad.	quick to understand or learn
intense	ad.	very strong
intense	ad.	extremely serious
interest	n.	what is important to someone	He acted to protect his interests. She had a great interest in painting.
interest	n.	a share in owning a business
interest	n.	money paid for the use "of money borrowed
interfere	v.	to get in the way of
interfere	v.	to work against
interfere	v.	to take part in the activities of others, especially when not asked to do so
international	ad.	of or about more than one nation or many nations
international	ad.	of the whole world
Internet	n.	the extensive communications system that connects computers around the world
intervene	v.	to come between
intervene	v.	to come between in order to settle or solve
invade	v.	to enter an area or country by force with an army
invent	v.	to plan and make something never made before
invent	v.	to create a new thing or way of doing something
invest	v.	to give money to a business or organization with the hope of making more money
investigate	v.	to study or examine all information about an event, situation or charge
investigate	v.	to search for the truth
invite	v.	to ask someone to take part in or join an event, organization or gathering
involve	v.	to take part in
involve	v.	to become a part of
involve	v.	to include
iron	n.	a strong, hard metal used to make machines and tools
island	n.	a land area with water all around it
issue	n.	an important problem or subject that people are discussing or arguing about
it	pro.	a thing, place, event or idea that is being spoken about	The sky is blue, but it also has a few white clouds.
jail	n.	a prison for those waiting to be tried for a crime or for those serving sentences for crimes that are not serious
jewel	n.	a valuable stone, such as a diamond or emerald
job	n.	the work that one does to earn money
