a (an)	ad.	one
a (an)	ad.	any
a (an)	ad.	each
able	v.	having the power to do something
about	adj.	almost	about half
about	adj.	of or having a relation to	We talk about the weather.
above	ad.	at a higher place
abuse	n.	bad treatment causing harm or injury
accept	v.	to agree to receive
accident	n.	something that happens by chance or mistake
accident	n.	an unplanned event
accuse	v.	to say a person is responsible for an act or crime
accuse	v.	to make a statement against someone
across	ad.	from side to side
across	ad.	to the other side
act	v.	to do something
activist	n.	one who seeks change through action
actor	n.	someone acting in a play or show
add	v.	to put (something) with another to make it larger
add	v.	to say more
administration	n.	the executive part of a government, usually headed by a president or prime minister
admit	v.	to accept	admitted to the United Nations
admit	v.	to express one's guilt or responsibility	He admitted that what he did was wrong.
adult	n.	a grown person
advertise	v.	to show or present the qualities of a product to increase sales
advise	v.	to help with information, knowledge or ideas in making a decision
affect	v.	to produce an effect on
affect	v.	to influence	A lack of sleep affected the singer's performance.
afraid	ad.	feeling fear
after	ad.	later
after	ad.	behind
again	ad.	another time
again	ad.	as before
against	ad.	opposed to
against	ad.	not agreeing with something
age	n.	how old a person or thing is
agency	n.	an organization that is part of a larger group	an agency of the United Nations
aggression	n.	an attack against a person or country
aggression	n.	the violation of a country's borders
ago	ad.	of time past
ago	ad.	before now
agree	v.	to have the same belief as someone
agree	v.	to be willing to do something
agriculture	n.	farming
aid	v.	to help
aid	v.	to support
aid	n.	help, assistance
aim	v.	to point a gun at
aim	n.	a goal or purpose
air	n.	the mixture of gases around the earth, mostly nitrogen and oxygen, that we breathe
air force	n.	a military organization using airplanes
airplane	n.	a vehicle with wings that flies
airport	n.	a place where airplanes take off and land
album	n.	a collection of recorded music
alcohol	n.	a strong, colorless liquid, usually made from grain, used in drinks or in industrial products
alive	ad.	having life
alive	ad.	not dead
all	ad.	everything
all	ad.	everyone
all	ad.	the complete amount
ally	n.	a nation or person joined with another for a special purpose
almost	ad.	a little less than completely
alone	ad.	separated from others
along	ad.	near or on	along the road
already	ad.	before now
already	ad.	even now
also	ad.	added to
also	ad.	too
although	conj.	even if it is true that
always	ad.	at all times
always	ad.	every time
ambassador	n.	a nation's highest diplomatic representative (to another government)
amend	v.	to add to or to change (a proposal or law)
ammunition	n.	the bullets or shells fired from guns
among	ad.	in or part of (a group)
amount	n.	the number, size or weight of anything
anarchy	n.	a lack of order
anarchy	n.	lawlessness
ancestor	n.	a family member from the past
ancient	ad.	very old
ancient	ad.	long ago
and	conj.	also
and	conj.	in addition to
and	conj.	with
anger	n.	a strong emotion against someone or something
animal	n.	a living creature that moves, such as a dog or cat
anniversary	n.	a yearly celebration or observance of an event that happened in the past
announce	v.	to make known publicly
announce	v.	to declare officially
another	ad.	one more
another	ad.	a different one
answer	n.	a statement produced by a question
answer	v.	to make a statement after being asked a question
antibodies	n.	special proteins produced in the blood that kill harmful bacteria
any	ad.	one or more of no special kind
apologize	v.	to express regret for a mistake or accident for which one accepts responsibility
appeal	v.	to take to a higher court, person or group for a decision
appeal	v.	to call on somebody for help
appear	v.	to show oneself
appear	v.	to come into sight
appear	v.	to seem
appoint	v.	to name
appoint	v.	to choose	appoint a judge
approve	v.	to agree with
approve	v.	to agree to support
archeology	n.	the scientific study of past human life and activities
area	n.	any place or part of it
argue	v.	to offer reasons for or against something
argue	v.	to dispute
argue	v.	to disagree
arms	n.	military equipment
arms	n.	weapons
army	n.	military ground forces
around	ad.	on every side (of)
arrest	v.	to seize a person for legal action
arrest	v.	to take as a prisoner
arrive	v.	to come to a place, especially at the end of a trip
art	n.	expressions or creations by humans, such as paintings, music, writing or statues
artillery	n.	big guns
as	conj.	equally	as fast as
as	conj.	when
as	conj.	while
ash	n.	the part left after something burns
ask	v.	to question
ask	v.	to say something is wanted	We ask the teacher questions every day.
assist	v.	to help
astronaut	n.	a person who travels in space
astronomy	n.	the scientific study of stars and the universe
asylum	n.	political protection given by a government to a person from another country
at	prep.	in or near	at the edge
at	prep.	where	look at
at	prep.	when	at noon
atmosphere	n.	the gases surrounding any star or planet
atom	n.	a very small part of all things
atom	n.	the smallest part of an element that can join with parts of other elements
attach	v.	to tie together
attach	v.	to connect
attack	n.	a violent attempt to damage, injure or kill
attack	v.	to start a fight
attempt	v.	to work toward something
attempt	v.	to try
attempt	v.	to make an effort
attend	v.	to be present at
attention	n.	close or careful observing of, or listening to, someone or something	The student paid attention to his teacher.
automobile	n.	a vehicle with wheels used to carry people
automobile	n.	a car
autumn	n.	the time of the year between summer and winter
available	ad.	present and ready for use
available	ad.	willing to serve or help.	There was a list of available candidates.
average	n.	something (a number) representing the middle
average	ad.	common
average	ad.	normal
avoid	v.	to stay away from
awake	ad.	not sleeping
award	n.	an honor or prize for an act or service
away	ad.	not near
baby	n.	a newly born creature
back	n.	the part behind the front
back	ad.	the other way from forward
bacteria	n.	living things that are one cell and can be seen only through a microscope
bacteria	n.	some cause disease
bad	ad.	wrong
bad	ad.	acting against the law
bad	ad.	not good
balance	v.	to make two sides or forces equal
ball	n.	something round
balloon	n.	a device of strong, light material that rises when filled with gas lighter than air
ballot	n.	a piece of paper used for voting
ban	v.	to not permit
ban	v.	to stop
ban	n.	an official restriction
bank	n.	an organization that keeps and lends money
bar	v.	to prevent or block
barrier	n.	anything that blocks or makes an action difficult
base	n.	a military center
base	v.	to establish as a fact	Her research was based on experiments.
battle	n.	a fight between opposing armed forces
be	v.	to live
be	v.	to happen
be	v.	to exist
beat	v.	to hit again and again
beauty	n.	that which pleases the eye, ear or spirit
because	prep.	for the reason that	He left because he was sick.
become	v.	to come to be
bed	n.	a sleeping place
before	prep.	earlier
begin	v.	to do the first part of an action
begin	v.	to start
behavior	n.	the way in which a person or animal acts	The child's behavior was bad because he fought with other children.
behind	ad.	at the back of
behind	ad.	in back of
believe	v.	to think
believe	v.	to feel sure of
believe	v.	to accept as true
believe	v.	to trust
belong	v.	to be owned by
belong	v.	to be a member of
below	ad.	lower than
best	ad.	the most good
betray	v.	to turn against
betray	v.	to be false to
better	ad.	more good than
between	ad.	in the space or time that separates
between	ad.	from one to the other	talks between two nations
big	ad.	of great size
big	ad.	not small
bill	n.	a legislative proposal
biology	n.	the scientific study of life or living things in all their forms
bird	n.	a creature that flies
bite	v.	to cut with the teeth
black	ad.	dark
black	ad.	having the color like that of the night sky
blame	v.	to accuse
blame	v.	to hold responsible
bleed	v.	to lose blood
blind	ad.	not able to see
block	v.	to stop something from being done
block	v.	to prevent movement
blood	n.	red fluid in the body
blow	v.	to move with force, as in air	The wind blows.
blue	ad.	having the color like that of a clear sky
boat	n.	something built to travel on water that carries people or goods
body	n.	all of a person or animal
body	n.	the remains of a person or animal
boil	v.	to heat a liquid until it becomes very hot
bomb	n.	a device that explodes with great force
bomb	v.	to attack or destroy with bombs
bone	n.	the hard material in the body
book	n.	a long written work for reading
border	n.	a dividing line between nations
born	v.	to come to life
born	v.	to come into existence
borrow	v.	to take as a loan
both	ad.	not just one of two, but the two together
bottle	n.	a container, usually made of glass, to hold liquid
bottom	ad.	the lowest part of something
box	n.	something to put things into
box	n.	a container, usually made of paper or wood
boy	n.	a young male person
boycott	v.	to refuse to take part in or deal with
brain	n.	the control center of thought, emotions and body activity of all creatures
brave	ad.	having no fear
bread	n.	a food made from grain
break	v.	to divide into parts by force
break	v.	to destroy
breathe	v.	to take air into the body and let it out again
bridge	n.	a structure built over a waterway, valley or road so people and vehicles can cross from one side to the other
brief	ad.	short
brief	ad.	not long
bright	ad.	giving much light
bright	ad.	strong and clear in color
bring	v.	to come with something
broadcast	v.	to send information, stories or music by radio or television
broadcast	n.	a radio or television program
brother	n.	a male with the same father or mother as another person
brown	ad.	having the color like that of coffee
budget	n.	a spending plan
build	v.	to join materials together to make something
building	n.	anything built for use as a house, factory, office, school, store or place of entertainment
bullet	n.	a small piece of metal shot from a gun
burn	v.	to be on fire
burn	v.	to destroy or damage by fire
burst	v.	to break open suddenly
bury	v.	to put into the ground and cover with earth
bus	n.	a public vehicle to carry people
business	n.	one's work
business	n.	buying and selling to earn money
business	n.	trade
busy	ad.	doing something
busy	ad.	very active
but	conj.	however
but	conj.	other than
but	conj.	yet
buy	v.	to get by paying something, usually money
by	conj.	near
by	conj.	at
by	conj.	next to	by the road
by	conj.	from	a play by William Shakespeare
by	conj.	not later than	by midnight
cabinet	n.	a group of ministers that helps lead a government
call	v.	to give a name to	I call myself John.
call	v.	to ask for or request	They called for an end to the fighting.
calm	ad.	quiet
calm	ad.	peaceful
calm	ad.	opposite tense
camera	n.	a device for taking pictures
camp	n.	a place with temporary housing
campaign	n.	a competition by opposing political candidates seeking support from voters
campaign	n.	a connected series of military actions during a war
can	v.	to be able to
can	v.	to have the right to
can	n.	a container used to hold liquid or food, usually made of metal
cancel	v.	to end
cancel	v.	to stop
cancer	n.	a disease in which dangerous cells grow quickly and destroy parts of the body
candidate	n.	a person who seeks or is nominated for an office or an honor
capital	n.	the official center of a government
capital	n.	the city where a country's government is
capture	v.	to make a person or animal a prisoner
capture	v.	to seize or take by force
capture	v.	to get control of
car	n.	a vehicle with wheels used to carry people
car	n.	an automobile
car	n.	a part of a train
care	v.	to like
care	v.	to protect
care	v.	to feel worry or interest
career	n.	a chosen profession
career	n.	a person's working life	The actor's career lasted for thirty years.
careful	ad.	acting safely
careful	ad.	with much thought
carry	v.	to take something or someone from one place to another
case (court)	n.	a legal action
case (medical)	n.	an incident of disease	There was only one case of chicken pox at the school.
cat	n.	a small animal that often lives with humans
catch	v.	to seize after a chase
catch	v.	to stop and seize with the hands
cause	v.	to make happen
cause	n.	the thing or person that produces a result
ceasefire	n.	a halt in fighting, usually by agreement
celebrate	v.	to honor a person or event with special activities
cell	n.	a small mass of living material that is part of all plants and animals
century	n.	one hundred years
ceremony	n.	an act or series of acts done in a special way established by tradition
chairman	n.	a person leading a meeting or an organized group
champion	n.	the best
champion	n.	the winner
chance	n.	a possibility of winning or losing or that something will happen
change	v.	to make different
change	v.	to become different
charge	v.	to accuse someone of something, usually a crime
charge	n.	a statement in which someone is accused of something
chase	v.	to run or go after someone or something
cheat	v.	to get by a trick
cheat	v.	to steal from
cheer	v.	to shout approval or praise
chemicals	n.	elements found in nature or made by people
chemicals	n.	substances used in the science of chemistry
chemistry	n.	the scientific study of substances, what they are made of, how they act under different conditions, and how they form other substances
chief	n.	the head or leader of a group
chief	ad.	leading
chief	ad.	most important
child	n.	a baby
child	n.	a boy or girl
children	n.	more than one child
choose	v.	to decide between two or more
center	n.	the middle of something
center	n.	the place in the middle
center	n.	a place that is the main point of an activity
chromosome	n.	a line of genes
chromosome	n.	most human cells contain 46 chromosomes
circle	n.	a closed shape that has all its points equally distant from the center, like an "O"
citizen	n.	a person who is a member of a country by birth or by law
city	n.	any important large town
civilian	ad.	not military
civil rights	n.	the political, economic and social rights given equally to all people of a nation
claim	v.	to say something as a fact
clash	n.	a battle
clash	v.	to fight or oppose
class	n.	a group of students who meet to study the same subject
class	n.	also a social or economic group.	They were members of the middle class.
clean	v.	to make pure
clean	ad.	free from dirt or harmful substances	clean water
clear	ad.	easy to see or see through
clear	ad.	easily understood
clergy	n.	a body of officials within a religious organization
climate	n.	the normal weather conditions of a place
climb	v.	to go up or down something by using the feet and sometimes the hands
clock	n.	a device that measures and shows time
close	v.	to make something not open
close	ad.	near to
cloth	n.	a material made from plants, chemicals, animal hair and other substances
clothes	n.	what people wear
cloud	n.	a mass of fog high in the sky
coal	n.	a solid black substance used as fuel
coalition	n.	forces, groups or nations joined together
coast	n.	land on the edge of the ocean
coffee	n.	a drink made from the plant of the same name
cold	ad.	not warm
cold	ad.	having or feeling great coolness or a low temperature
collapse	v.	to fall down or inward suddenly
collapse	v.	to break down or fail suddenly in strength, health or power.	The building collapsed in the earthquake. The government collapsed after a vote in parliament.
collect	v.	to bring or gather together in one place
collect	v.	to demand and receive	collect taxes
college	n.	a small university
colony	n.	land controlled by another country or government
color	n.	the different effects of light on the eye, making blue, red, brown, black, yellow and others
combine	v.	to mix or bring together
come	v.	to move toward
come	v.	to arrive
command	v.	to order
command	v.	to have power over something
comment	v.	to say something about
comment	v.	to express an opinion about something
committee	n.	a group of people given special work
common	ad.	usual
common	ad.	same for all	a common purpose
communicate	v.	to tell
communicate	v.	to give or exchange information
community	n.	a group of people living together in one place or area
company	n.	a business organized for trade, industrial or other purposes
compare	v.	to examine what is different or similar
compete	v.	to try to do as well as, or better than, another or others
complete	ad.	having all parts
complete	ad.	ended or finished
complex	ad.	of or having many parts that are difficult to understand
complex	ad.	not simple
compound	n.	a substance containing two or more elements
compromise	n.	the settlement of an argument where each side agrees to accept less than first demanded
computer	n.	an electronic machine for storing and organizing information, and for communicating with others
concern	n.	interest, worry	express concern about
concern	v.	to fear	to be concerned
condemn	v.	to say a person or action is wrong or bad
condition	n.	something declared necessary to complete an agreement
condition	n.	a person's health
conference	n.	a meeting
confirm	v.	to approve
confirm	v.	to say that something is true
conflict	n.	a fight
conflict	n.	a battle, especially a long one
congratulate	v.	to praise a person or to express pleasure for success or good luck
Congress	n.	the organization of people elected to make the laws of the United States (the House of Representatives and the Senate)
Congress	n.	a similar organization in other countries
connect	v.	to join one thing to another
connect	v.	to unite
connect	v.	to link
conservative	n.	one who usually supports tradition and opposes great change
consider	v.	to give thought to
consider	v.	to think about carefully
constitution	n.	the written general laws and ideas that form a nation's system of government
contact	n.	the act of touching or being close to a person or thing	He was in contact with animals that had the disease.
contact	v.	to meet or communicate with	He wanted to contact his local official.
contain	v.	to hold
contain	v.	to include
container	n.	a box, bottle or can used to hold something
continent	n.	any of the seven great land areas of the world
continue	v.	to go on doing or being
control	v.	to direct
control	v.	to have power over
convention	n.	a large meeting for a special purpose
cook	v.	to heat food before eating it
cool	ad.	almost cold
cooperate	v.	to act or work together
copy	v.	to make something exactly like another
copy	n.	something made to look exactly like another
corn	n.	a food grain
correct	ad.	true
correct	ad.	free from mistakes
correct	v.	to change to what is right
corruption	n.	actions taken to gain money or power that are legally or morally wrong
cost	n.	the price or value of something	The cost of the book is five dollars.
cost	v.	to be valued at
cotton	n.	a material made from a plant of the same name
count	v.	to speak or add numbers
country	n.	a nation
country	n.	the territory of a nation
country	n.	land away from cities
court	n.	where trials take place
court	n.	where judges make decisions about law
cover	v.	to put something over a person or thing
cover	n.	anything that is put over a person or thing
cow	n.	a farm animal used for its milk
crash	v.	to fall violently
crash	v.	to hit with great force
create	v.	to make
create	v.	to give life or form to
creature	n.	any living being
creature	n.	any animal or human
credit	n.	an agreement that payments will be made at a later time
crew	n.	a group of people working together
crime	n.	an act that violates a law
criminal	n.	a person who is responsible for a crime
crisis	n.	an extremely important time when something may become much better or worse
crisis	n.	a dangerous situation
criticize	v.	to say what is wrong with something or someone
criticize	v.	to condemn
criticize	v.	to judge
crops	n.	plants that are grown and gathered for food, such as grains, fruits and vegetables
cross	v.	to go from one side to another
cross	v.	to go across
crowd	n.	a large number of people gathered in one place
crush	v.	to damage or destroy by great weight
crush	v.	to defeat completely
cry	v.	to express or show sorrow or pain
culture	n.	all the beliefs, traditions and arts of a group or population
cure	v.	to improve health
cure	v.	to make well	The doctor can cure the disease.
cure	n.	something that makes a sick person well	Antibiotics are a cure for infection.
curfew	n.	an order to people to stay off the streets or to close their businesses
current	n.	movement of air, water or electricity
current	ad.	belonging to the present time	She found the report in a current publication.
custom	n.	a long-established belief or activity of a people
customs	n.	taxes on imports
cut	v.	to divide or injure with a sharp tool
cut	v.	to make less
cut	v.	to reduce
dam	n.	a wall built across a river to hold back flowing water
damage	v.	to cause injury or destruction
damage	n.	harm
damage	n.	hurt or injury, usually to things
dance	v.	to move the body and feet to music
dance	n.	a series of steps, usually to music
danger	n.	a strong chance of suffering injury, damage or loss
dark	ad.	having little or no light	The room was dark.
date	n.	an expression of time
date	n.	a day, month and year
daughter	n.	a person's female child
day	n.	twenty-four hours
day	n.	the hours of sunlight
dead	ad.	not living
deaf	ad.	not able to hear
deal	v.	to have to do with	The talks will deal with the problem of pollution.
deal	v.	to buy or sell	Her company deals in plastic.
deal	n.	an agreement
debate	v.	to argue for or against something
debate	n.	a public discussion or argument
debt	n.	something that is owed
debt	n.	the condition of owing
decide	v.	to choose
decide	v.	to settle
decide	v.	to judge
declare	v.	to say
declare	v.	to make a statement
decrease	v.	to make less in size or amount
deep	ad.	going far down
deep	ad.	a long way from top to bottom
defeat	v.	to cause to lose in a battle or struggle
defeat	n.	a loss
defeat	n.	the condition of having lost
defend	v.	to guard or fight against attack
defend	v.	to protect
deficit	n.	a shortage that results when spending is greater than earnings, or imports are greater than exports
define	v.	to give the meaning of
define	v.	to explain
degree	n.	a measure of temperature
delay	v.	to decide to do something at a later time
delay	v.	to postpone
delay	v.	to cause to be late
delegate	n.	one sent to act for another
delegate	n.	one who represents another
demand	v.	to ask by ordering
demand	v.	to ask with force
democracy	n.	the system of government in which citizens vote to choose leaders or to make other important decisions
demonstrate	v.	to make a public show of opinions or feelings	The crowd demonstrated in support of human rights.
demonstrate	v.	to explain by using examples	The teacher demonstrated the idea with an experiment.
dense	ad.	close together
dense	ad.	thick
denounce	v.	to accuse of being wrong or evil
denounce	v.	to criticize severely
deny	v.	to declare that something is not true
deny	v.	to refuse a request
depend	v.	to need help and support
deplore	v.	to regret strongly
deplore	v.	to express sadness
deploy	v.	to move forces or weapons into positions for action
depression	n.	severe unhappiness
depression	n.	a period of reduced business and economic activity during which many people lose their jobs
describe	v.	to give a word picture of something
describe	v.	to give details of something
desert	n.	a dry area of land
design	v.	to plan or create plans for
desire	v.	to want very much
desire	v.	to wish for
destroy	v.	to break into pieces
destroy	v.	to end the existence of
detail	n.	a small part of something
detail	n.	a small piece of information
detain	v.	to keep or hold	The police detained several suspects for questioning.
develop	v.	to grow
develop	v.	to create
develop	v.	to experience progress
device	n.	a piece of equipment made for a special purpose
dictator	n.	a ruler with complete power
die	v.	to become dead
die	v.	to stop living
die	v.	to end
diet	n.	usual daily food and drink
different	ad.	not the same
difficult	ad.	not easy
difficult	ad.	hard to do, make or carry out
dig	v.	to make a hole in the ground
dinner	n.	the main amount of food eaten at a usual time	The family had its dinner at noon.
dinner	n.	a special event that includes food	The official dinner took place at the White House.
diplomat	n.	a person who represents his or her government in dealing with another government
direct	v.	to lead
direct	v.	to aim or show the way	He directed me to the theater.
direct	ad.	straight to something
direct	ad.	not through some other person or thing	The path is direct.
direction	n.	the way (east, west, north, south)
direction	n.	where someone or something came from or went to
dirt	n.	earth or soil
disappear	v.	to become unseen
disappear	v.	to no longer exist
disarm	v.	to take away weapons
disarm	v.	to no longer keep weapons
disarm	v.	to make a bomb harmless by removing its exploding device
disaster	n.	an event causing widespread destruction or loss of life, such as an earthquake or plane crash
discover	v.	to find or learn something
discrimination	n.	unfair treatment or consideration based on opinions about a whole group instead of on the qualities of an individual.	He was accused of discrimination against people from other countries.
discuss	v.	to talk about
discuss	v.	to exchange ideas
disease	n.	a sickness in living things, often caused by viruses, germs or bacteria
dismiss	v.	to send away
dismiss	v.	to refuse to consider
dispute	v.	to oppose strongly by argument
dispute	n.	an angry debate
dissident	n.	a person who strongly disagrees with his or her government
distance	n.	the amount of space between two places or objects	The distance from my house to your house is two kilometers.
dive	v.	to jump into water head first
divide	v.	to separate into two or more parts
do	v.	to act
do	v.	to make an effort
doctor	n.	a person trained in medicine to treat sick people
